{
  "input_contract_version": "1.0.0",
  "software_type_ids": [
    "software_type.ai_agents"
  ],
  "facts": [
    {
      "fact_id": "approval_record_present",
      "state": "false",
      "scope": "project",
      "origin": "explicit_scope"
    },
    {
      "fact_id": "approval_required_for_high_impact",
      "state": "true",
      "scope": "project",
      "origin": "explicit_scope"
    },
    {
      "fact_id": "approver_available",
      "state": "false",
      "scope": "project",
      "origin": "explicit_scope"
    },
    {
      "fact_id": "can_cause_side_effects",
      "state": "false",
      "scope": "project",
      "origin": "explicit_requirement"
    },
    {
      "fact_id": "candidate_identified",
      "state": "false",
      "scope": "project",
      "origin": "explicit_scope"
    },
    {
      "fact_id": "data_sensitivity_known",
      "state": "false",
      "scope": "project",
      "origin": "explicit_scope"
    },
    {
      "fact_id": "distinct_responsibilities",
      "state": "false",
      "scope": "project",
      "origin": "explicit_scope"
    },
    {
      "fact_id": "has_bounded_write_tool",
      "state": "false",
      "scope": "project",
      "origin": "explicit_requirement"
    },
    {
      "fact_id": "has_read_access",
      "state": "true",
      "scope": "project",
      "origin": "explicit_scope"
    },
    {
      "fact_id": "high_impact_action_possible",
      "state": "false",
      "scope": "project",
      "origin": "explicit_requirement"
    },
    {
      "fact_id": "multi_agent_autonomy_requested",
      "state": "false",
      "scope": "project",
      "origin": "explicit_scope"
    },
    {
      "fact_id": "production_deployment_requested",
      "state": "false",
      "scope": "project",
      "origin": "explicit_scope"
    },
    {
      "fact_id": "reads_untrusted_external_content",
      "state": "true",
      "scope": "project",
      "origin": "explicit_scope"
    },
    {
      "fact_id": "reference_example_requested",
      "state": "true",
      "scope": "project",
      "origin": "explicit_scope"
    },
    {
      "fact_id": "release_plan_required",
      "state": "false",
      "scope": "project",
      "origin": "explicit_scope"
    },
    {
      "fact_id": "tests_executed",
      "state": "false",
      "scope": "project",
      "origin": "explicit_scope"
    },
    {
      "fact_id": "threat_model_reviewed",
      "state": "false",
      "scope": "project",
      "origin": "explicit_scope"
    },
    {
      "fact_id": "tool_scope_reviewed",
      "state": "false",
      "scope": "project",
      "origin": "explicit_scope"
    },
    {
      "fact_id": "vector_database_requested",
      "state": "false",
      "scope": "project",
      "origin": "explicit_scope"
    }
  ],
  "authority": {
    "high_impact_approver": {
      "state": "false",
      "principal_id": null,
      "evidence_id": null
    },
    "write_scope_authorized": {
      "state": "unknown",
      "principal_id": null,
      "evidence_id": null
    }
  },
  "evidence": {
    "candidate": {
      "state": "unknown",
      "candidate_id": null
    },
    "tests": {
      "state": "false",
      "candidate_id": null,
      "execution_record_id": null,
      "result": "not_run"
    },
    "approval": {
      "state": "unknown",
      "approval_record_id": null,
      "approver_id": null
    }
  },
  "standards": [],
  "descriptive_text": {
    "text": "An AI agent reads untrusted external content, has read access and a bounded write-capable tool, and can cause side effects. It has no standing approval for high-impact actions. Design must state trust boundaries, authorization and approval, rollback/recovery, and test evidence conditions. No test or CI execution has occurred.",
    "authority": "non_authoritative"
  },
  "missing_inputs": [
    "approval record and named approver for any high-impact action",
    "availability, scale, budget, regulatory and operational constraints",
    "candidate identity",
    "candidate identity, versioned requirements and acceptance criteria",
    "candidate identity/revision and artifact digest",
    "data sensitivity and trust boundaries in detail",
    "deployment topology, rollback target, health signals and owner",
    "deployment topology, rollback target, health signals and recovery owner",
    "product goals and user workflows",
    "reviewed threat model and risk dispositions",
    "test plan, test run logs/results and CI run status",
    "tool inventory, exact write scope, authorization model and side-effect impact"
  ]
}
